,Park,Park Code,Park Type,Coord,Is Streaming?,Webcam URL,Images,Info
133,Glacier National Park,glac,National Park,"[48.697, -113.7198]",Inactive,https://www.nps.gov/media/webcam/view.htm?id=81B4690A-1DD8-B71B-0B2D069E1CB02E6A,[],"To many visitors to the park, this view is their first introduction to the spectacular scenery of Glacier National Park. This iconic view from Apgar, at the foot of Lake McDonald, really shows what Glacier is all about...big glacially carved lakes, vast wild views of the high peaks along the Continental Divide, and the ever-changing forests that blanket much of the lower elevations. It's no wonder that for many people when they think of Glacier, they think of this view."
134,Glacier National Park,glac,National Park,"[48.697, -113.7198]",Active,https://www.nps.gov/media/webcam/view.htm?id=81B4691B-1DD8-B71B-0BB9DBEE21A59335,[],This view to the northeast from the summit of Apgar Mountain provides a spectacular view of Lake McDonald and the mountains in the distance. To the left of the lake are Stanton Mountain and Mt. Vaught (Stanton just in front of Vaught) and then just to the right the Garden Wall. The Continental Divide follows the crest of the Garden Wall. Continuing to the right are Mt. Cannon and Mt. Brown. The last mountain clearly visible to the right is Edwards Mountain. Apgar Lookout is at the summit and one of the more popular hikes on the west side.
135,Glacier National Park,glac,National Park,"[48.697, -113.7198]",Active,https://www.nps.gov/media/webcam/view.htm?id=81B4692D-1DD8-B71B-0B9AE4B7C186B022,[],"The village of Apgar is the main hub of activity (on the west side of the park) throughout the summer. The park's largest campground is located here as are gift shops, a restaurant, lodging facilities, and boat and recreational equipment rentals."
136,Glacier National Park,glac,National Park,"[48.697, -113.7198]",Active,https://www.nps.gov/media/webcam/view.htm?id=81B46943-1DD8-B71B-0B46D68861599592,[],"This was the first webcam view that Glacier National Park offered. Originally it was only going to be a test until a better location was found, but it turns out that this view has a large following. Watch for the occasional lunchtime crowd at the picnic table or our resident deer wandering about. Some years in the early summer beargrass blooms dot the forest."
137,Glacier National Park,glac,National Park,"[48.697, -113.7198]",Active,https://www.nps.gov/media/webcam/view.htm?id=81B46955-1DD8-B71B-0B698C4D88410C05,[],"The Middle Fork of the Flathead River forms the southwest border of Glacier National Park. This view, from near Park Headquarters, shows the river as it flows under the West Glacier bridge. At night some of the lights of West Glacier may be visible. During the summer, watch for rafters. Several commercial rafting businesses use this section of river. In the winter, the only activity along the river might be the occasional coyote or deer or a really cold kayaker."
138,Glacier National Park,glac,National Park,"[48.697, -113.7198]",Active,https://www.nps.gov/media/webcam/view.htm?id=33478DF3-1DD8-B71B-0B8C97DB0A03B0F7,[],"The West Entrance to the park is a good indicator of how busy things may be at locations inside the park. During July and August expect to see a long string of cars as they line up to purchase their entrance passes. We sell several different passes including a 7-day pass for $35.00, an annual pass for $70.00, and the America the Beautiful Pass for $80.00. The America the Beautiful Pass will allow entrance into any national park in the country and is good for some services on National Forests and at other Federal agencies."
139,Glacier National Park,glac,National Park,"[48.697, -113.7198]",Active,https://www.nps.gov/media/webcam/view.htm?id=7290EA71-A74E-A7B4-74805070A3996FAC,[],Throughout the summer this is the primary information stop for visitors entering the park at West Glacier. The visitor center is closed during winter but there are informational displays and publications available in the plaza.
140,Glacier National Park,glac,National Park,"[48.697, -113.7198]",Inactive,https://www.nps.gov/media/webcam/view.htm?id=D428B88A-BC1A-A5BF-88E3D63CF89D3452,[],This camera is one of the newer models that allow us to zoom in and pan around the scene. Expect to see different views occasionally as we aim it at different parts of the Lake McDonald Valley. Thanks to the Glacier National Park Conservancy for their continued support of the park's webcam installations.
141,Glacier National Park,glac,National Park,"[48.697, -113.7198]",Active,https://www.nps.gov/media/webcam/view.htm?id=AE7C9B53-910E-6D3A-D6133266826C6977,[],"The view from this webcam can be changed by park staff and occasionally we will move it and provide a different aspect of the view from the St. Mary Visitor Center. We hope to be able to provide close views of the elk in the fall and winter, tighter views of the mountains, and occasionally people at the Entrance Station and in the Visitor Center. Thanks to the Glacier National Park Conservancy for their continued support of the park's webcam installations."
142,Glacier National Park,glac,National Park,"[48.6816, -113.7993]",Active,https://www.nps.gov/media/webcam/view.htm?id=2EB5C6A5-DF18-084C-8F28F31A1508E942,[],"This view from the St. Mary Visitor Center looks west to the mountains surrounding St. Mary Lake. Red Eagle Mountain looms directly in the center. In the winter and spring, elk are often spotted in the meadow at first light. In summer, wildflowers carpet the view. Fall sees the green turn to a golden hue which contrasts with the bright blue of the sky."
143,Glacier National Park,glac,National Park,"[48.6816, -113.7993]",Inactive,https://www.nps.gov/media/webcam/view.htm?id=29B542D5-CD61-DA35-B357D5938D5CB9EE,[],This view from near the Scenic Point Trailhead looks northwest to the Dawson Pass area. The mountains in the foreground are Sinopah Mountain on the left and Rising Wolf Mountain on the right. In the distance Lone Walker Mountain is just visible over the shoulder of Sinopah and Helen Mountain is just to the right of center. One of the best hikes in the park works its way up to Dawson Pass and then continues north along the spine of the Continental Divide to Pitamakan Pass. Five miles of high-elevation hiking that is second to none.
144,Glacier National Park,glac,National Park,"[48.6816, -113.7993]",Inactive,https://www.nps.gov/media/webcam/view.htm?id=29CE45EA-EF1D-13A4-9C8E92F1FBFED9C7,[],"This view from near the campground in Two Medicine shows how dominant Sinopah Mountain is on the landscape there. To the left is Painted Tepee Mountain and to the right is Mount Helen. Once a primary stop on all train and horseback trips in the park, the opening of the Going-to-the-Sun Road in the 1930s shifted visitation to other parts of the park. While not as busy as some locations today, it is still crowded and visitors are advised to arrive early to find parking."
145,Glacier National Park,glac,National Park,"[48.6816, -113.7993]",Inactive,https://www.nps.gov/media/webcam/view.htm?id=2B15B960-C427-0389-BDC2FA209372B7F6,[],"Across Swiftcurrent Lake rises Mt. Wilbur. To the left of the summit you can see the Continental Divide and Swiftcurrent Peak. To the right you can just barely see part of the cirque that contains Iceberg Lake. Iceberg Lake is one of the most popular hikes in the park. It is about 10 miles round trip with an elevation gain of around 1,200 feet. It is one of the easier of the all-day hikes in this valley. Wide open areas afford expansive views as you hike up to the lake. As with all hikes be on the watch for signs of bears. This trail may be closed when you arrive due to bear activity."
146,Glacier National Park,glac,National Park,"[48.6816, -113.7993]",Inactive,https://www.nps.gov/media/webcam/view.htm?id=679C246C-E655-8581-E98B21793E10D6EA,[],"This camera at Apgar will generally be pointed west, toward the Apgar Wilderness Permit Office, just out of view. In summer, lines of backpackers will be seen each morning accessing the Permit Office. Fall and winter present a calmer scene. This camera seems to have a somewhat erratic connection and may stop sending images for periods of time. We are working to repair or replace it."
147,Glacier National Park,glac,National Park,"[48.6816, -113.7993]",Inactive,https://www.nps.gov/media/webcam/view.htm?id=2ABFE780-E817-D105-9B14697AEB43EBA6,[],"Many Glacier is often referred to as the Heart of the Park. This spectacular view is very similar to the Two Medicine Valley in that there is a dominant peak, in this case Grinnell Point, separating two valleys. To the right is the Swiftcurrent Valley and just up and over the wall in the background is Granite Park. To the left is the valley that leads up to Grinnell Glacier, one of the most popular trails in the park. The Many Glacier Hotel sits at the edge of Swiftcurrent Lake and is an outstanding example of the type of architecture that was so common in the western national parks in the early 1900. A walk through it's soaring lobby is a must see when you visit Many Glacier."
148,Glacier National Park,glac,National Park,"[48.7471, -113.438]",Active,https://www.nps.gov/media/webcam/view.htm?id=FEBE3539-D0B5-B95A-B341B5A5C777FB9E,[],"Imagine laying on your back in the St. Mary valley and looking straight up at the sky. That is your view from this webcam. On a clear night the image of the sky is spectacular, so visit after dark for the best experience. The tan shape at the top is the Dusty Star Observatory. The other buildings in the area include the St. Mary Visitor Center and the St. Mary entrance station. The center of the image looks straight up at the sky. If the circular image is a clock, the Dusty star Observatory is to the east at 12'clock, north is at 3 o'clock, west is at 6 o'clock. and south is at 9 o'clock."
149,Colorado National Monument,colm,National Monument,"[39.1012, -108.7345]",Active,https://www.nps.gov/media/webcam/view.htm?id=81B46AB6-1DD8-B71B-0B12AA5101C4657E,"[{'url': 'https://www.nps.gov/common/uploads/cropped_image/BDB20F0C-C6FC-67C0-1167C5015531E4C6.jpg', 'credit': 'NPS Photo - LHartman', 'altText': 'Canyon with tan and red rock walls. Snow capped, flat topped mountain in distance.', 'title': 'Wedding Canyon', 'description': '', 'caption': 'View of Wedding Canyon with Grand Mesa in the Distance.', 'crops': [{'aspectRatio': 1.78, 'url': 'https://www.nps.gov/common/uploads/cropped_image/primary/BDB20F0C-C6FC-67C0-1167C5015531E4C6.jpg'}, {'aspectRatio': 1.33, 'url': 'https://www.nps.gov/common/uploads/cropped_image/secondary/BDB20F0C-C6FC-67C0-1167C5015531E4C6.jpg'}]}]","View from the Saddlehorn Visitor Center on Rim Rock Drive. On most days a small sliver of the visitor center roof is in the foreground, beyond that are the red rock cliffs of Wedding and Monument canyons. On a clear day, in the distance, one can see the Grand Mesa (one of the largest flat-topped mountains in the United States)."
150,Yellowstone National Park,yell,National Park,"[44.6623, -111.0998]",Active,https://www.nps.gov/media/webcam/view.htm?id=81B46891-1DD8-B71B-0B6575944D4DECD5,[],"Construction currently occurring at the fire tower. Construction equipment may occasionally be visible. At 10,219 feet, Mount Washburn towers above Dunraven Pass between Tower Junction and Canyon Village. A fire lookout stationed at the summit provides a popular destination for day hikers, as well as housing for an employee who watches for and tracks fires throughout the summer. This webcam is located inside the living quarters on the top floor and looks out to the northeast."
151,Yellowstone National Park,yell,National Park,"[44.6623, -111.0998]",Active,https://www.nps.gov/media/webcam/view.htm?id=81B468AB-1DD8-B71B-0BE84D8E8E0F1112,[],"Morning views from this webcam are spectacular, especially during the winter when the morning sun touches Electric Peak. Look for wildlife—elk, bison, and pronghorn can be seen grazing here. Occasionally you may see the top of oversize vehicles—RVs, tour buses, and delivery trucks—as they stop at the entrance station."
152,Yellowstone National Park,yell,National Park,"[44.6623, -111.0998]",Active,https://www.nps.gov/media/webcam/view.htm?id=81B468BC-1DD8-B71B-0BBA4C383E179188,[],"This webcam is on the park's North Entrance at Gardiner, Montana. It shows current conditions at the entrance with Roosevelt Arch in the background. The arch became known as Roosevelt Arch after President Theodore Roosevelt, who was vacationing in the park, spoke at the ceremony to lay the cornerstone in 1903. The arch is inscribed with a phrase from the legislation establishing Yellowstone National Park: ""For the benefit and enjoyment of the people."""
153,Yellowstone National Park,yell,National Park,"[44.4599, -110.8306]",Active,https://www.nps.gov/yell/learn/photosmultimedia/webcams.htm#E8D8EFA8-B656-47C5-B9DF-D81AF7AA53D4,[],"This live view is made possible by the <em>Eyes on Yellowstone</em> program funded by <strong>Canon USA, Inc.</strong> through a generous grant to <strong>Yellowstone Forever</strong>."
154,John Day Fossil Beds National Monument,joda,National Monument,"[-27.4918, 151.7637]",Inactive,https://www.nps.gov/media/webcam/view.htm?id=81B462DF-1DD8-B71B-0B883DE9E8EC694F,[],"Science takes center stage at John Day Fossil Beds National Monument. Our Paleontology Lab Cam allows you to watch our paleontologists remove rock from around fossils. Sometimes there are other tasks to do, but when they are working on other projects, they usually leave a fossil that they have been working on in the camera's field of view. The lights usually come on at 9am Pacific and go out at 5pm Pacific. This camera refreshes every 20 seconds."
155,Arches National Park,arch,National Park,"[38.611, -109.6082]",Active,https://www.nps.gov/media/webcam/view.htm?id=81B46BCF-1DD8-B71B-0B91099975A047A5,[],This webcam is maintained by the Utah Department of Transportation. It is located across US 191 from the Arches National Park entrance road.
156,Arches National Park,arch,National Park,"[38.6166, -109.6162]",Active,https://www.nps.gov/media/webcam/view.htm?id=81B46BDB-1DD8-B71B-0B250E8F4CC1E74A,"[{'url': 'https://www.nps.gov/common/uploads/cropped_image/C9A5A9B2-A3AB-2C2F-EEEF02898281DCCE.jpg', 'credit': '', 'altText': ""White text on a black background with NPS Arrowhead describes webcam's inactive state."", 'title': 'Inactive Webcam', 'description': '', 'caption': 'The Arches Entrance Station Webcam is temporarily unavailable', 'crops': [{'aspectRatio': 1.78, 'url': 'https://www.nps.gov/common/uploads/cropped_image/primary/C9A5A9B2-A3AB-2C2F-EEEF02898281DCCE.jpg'}, {'aspectRatio': 1.33, 'url': 'https://www.nps.gov/common/uploads/cropped_image/secondary/C9A5A9B2-A3AB-2C2F-EEEF02898281DCCE.jpg'}]}]",View the entrance road as seen from the Arches Entrance Station. This view looks toward US 191.
157,Curecanti National Recreation Area,cure,National Recreation Area,"[38.4656, -107.1709]",Active,https://www.nps.gov/media/webcam/view.htm?id=41636348-0A31-A112-AC4E14F276579B6F,[],View from Elk Creek Campground looking towards Cebolla Basin on Blue Mesa Reservoir.
158,Lava Beds National Monument,labe,National Monument,"[41.7142, -121.5098]",Active,https://www.nps.gov/media/webcam/view.htm?id=81B46183-1DD8-B71B-0B44D2EBCDA304A5,[],"From over 4,700 feet above sea level, this webcam looks out from the visitor center north over nearly 30,000 acres of wilderness towards the Tule Lake Basin 20 miles away. Please click on the link for the most up-to-date image."
159,Grand Canyon National Park,grca,National Park,"[36.058, -112.1427]",Active,https://www.nps.gov/media/webcam/view.htm?id=81B467D6-1DD8-B71B-0BE07E579A95DA72,[],"To help time your South Rim arrival, monitor the South Entrance Station Webcam. During busy weekends, there can be long lines and up to two hour wait times between 10 am - 5 pm. This view refreshes every minute. The entrance station is about 1.6 miles (2.5 km) north of the gateway town of Tusayan, AZ."
160,Grand Canyon National Park,grca,National Park,"[35.2392, -111.8329]",Active,https://www.nps.gov/media/webcam/view.htm?id=348818A5-C6EE-66E7-41F5F43A4C334357,[],"Webcam courtesy of the National Weather Service office in Bellemont, Arizona. In the distance, the San Francisco Peaks with Mount Humphreys at 12,633 feet (3,850 m) above sea level, the highest point in the state of Arizona. Bellemont is located along Interstate 40, 13.6 miles (22 Km) east of Flagstaff, Arizona."
161,Grand Canyon National Park,grca,National Park,"[35.6521, -112.1395]",Active,https://www.nps.gov/media/webcam/view.htm?id=692DB1BB-E2E6-22EC-034062D3C0C936B5,[],"The view is from Valle, Arizona, near the junction of US 180 (from Flagstaff) and SR 64 (from Williams) The location is also called ""Grand Canyon Junction"". The South Rim of Grand Canyon National Park is 26 miles (41 km) north of this location. Live view courtesy of Arizona Dept. of Transportation 511. The image updates every 6 minutes."
162,Grand Canyon National Park,grca,National Park,"[35.1845, -111.6333]",Active,https://www.nps.gov/media/webcam/view.htm?id=69687067-BE16-062D-2F789E22263AABA3,[],"This camera shows the current weather, traffic and road conditions at Mile 197.6 of Interstate 40 —one of the main highways travelers use to reach Grand Canyon National Park. Live view courtesy Arizona Dept. of Transportation 511. The image updates every 6 minutes."
163,Grand Canyon National Park,grca,National Park,"[36.058, -112.1426]",Active,https://www.nps.gov/media/webcam/view.htm?id=69E0162D-0ED1-F68A-6B52A11F95FD867B,[],"Bright Angel Trail starts into the canyon from Kolb Studio in Grand Canyon Village. For more than 60 years, mule trips descending into the canyon would pose here for group photos. Bright Angel Trail is the park’s most popular hiking trail. Verify that the time and date of the picture is current (upper right in the image) Camera hosted by Grand Canyon Conservancy. The image updates every 7 minutes."
164,Grand Canyon National Park,grca,National Park,"[36.058, -112.1427]",Active,https://www.nps.gov/media/webcam/view.htm?id=6A810B9D-FB9E-434B-2215EE8E8AB6D5B3,[],"In this north-facing view, the Battleship is in the center, and Indian Garden is visible - lower right, 3000 feet (915 m) below. Kolb Studio was the family home and photography studio of the Kolb Brothers, pioneer photographers at Grand Canyon. Verify that the time and date of the picture is current (upper right in image) Camera hosted by Grand Canyon Conservancy. The image updates every 7 minutes."
165,Grand Canyon National Park,grca,National Park,"[36.0658, -112.118]",Active,https://www.nps.gov/subjects/air/webcams.htm?site=grca,[],"The view is from Yavapai Point on the South Rim of the park. The view refreshes every 15 minutes. Grand Canyon National Park's Air Quality Webcam offers a window into the current sights, weather, air quality and seasonal changes that the park is experiencing."
166,Black Canyon Of The Gunnison National Park,blca,National Park,"[38.555, -107.6866]",Active,https://www.nps.gov/media/webcam/view.htm?id=0FA6F288-B063-7618-DF540382B0C0A179,[],View of Gunnison Point overlook from South Rim Visitor Center
167,Black Canyon Of The Gunnison National Park,blca,National Park,"[38.5426, -107.6867]",Active,https://www.nps.gov/media/webcam/view.htm?id=10418AE0-DA0E-967C-30E3C611BCFA949F,[],View from near the South Rim Campground looking towards Grizzly Ridge on the North Rim.
168,Bryce Canyon National Park,brca,National Park,"[37.584, -112.1828]",Active,https://www.nps.gov/subjects/air/webcams.htm?site=brda,"[{'url': 'https://www.nps.gov/common/uploads/cropped_image/1F145C91-0E69-6041-5CBB2B5755D7814C.jpg', 'credit': 'NPS Photo', 'altText': 'View of hazy valley beyond forested cliffs', 'title': 'Air Quality Camera', 'description': '', 'caption': 'Check out the current air quality at the southern end of the park', 'crops': [{'aspectRatio': 1.78, 'url': 'https://www.nps.gov/common/uploads/cropped_image/primary/1F145C91-0E69-6041-5CBB2B5755D7814C.jpg'}, {'aspectRatio': 1.33, 'url': 'https://www.nps.gov/common/uploads/cropped_image/secondary/1F145C91-0E69-6041-5CBB2B5755D7814C.jpg'}]}]","View from Yovimpa Point, Bryce Canyon National Park, Utah (looking east)."
